title,author,content
Python for Beginners,John Doe,This book is an introduction to Python programming with examples.
Data Science Explained,Jane Smith,"Learn about data science, statistics, and machine learning techniques."
Artificial Intelligence,Alan Turing,"A deep dive into AI, neural networks, and algorithms."
Advanced Python Programming,Emily Davis,In-depth exploration of Python’s advanced features and libraries.
Introduction to Machine Learning,Sarah Lee,"Learn the basics of machine learning, algorithms, and model building."
Data Structures and Algorithms,Michael Brown,Comprehensive guide to understanding data structures and algorithms in programming.
Deep Learning with Python,Francois Chollet,Master deep learning concepts and techniques using Python and Keras.
AI Superpowers,Kai-Fu Lee,An analysis of AI development in China and the US and their impact on the future.
Machine Learning Yearning,Andrew Ng,Insights into the strategies and techniques needed to build machine learning systems.
"Hands-On Machine Learning with Scikit-Learn, Keras, and TensorFlow",Aurélien Géron,Practical guide to implementing machine learning models using popular Python libraries.
The Hundred-Page Machine Learning Book,Andriy Burkov,A concise introduction to machine learning concepts and algorithms.
Python Data Science Handbook,Jake VanderPlas,"A comprehensive guide to data science using Python libraries such as Pandas, Matplotlib, and Scikit-learn."
Fluent Python,Luciano Ramalho,Deep dive into Python programming focusing on writing Pythonic code.
The Elements of Statistical Learning,Trevor Hastie,An advanced statistical learning book covering various machine learning techniques.
Introduction to Statistical Learning,Gareth James,"Introductory book for machine learning, focusing on statistical approaches to data analysis."
